<?xml version="1.0" encoding="ISO-8859-15"?>

<rootTag xmlns:xsi="http://www.w3.org/2001/XMLSchema-instance" xsi:noNamespaceSchemaLocation= "out.xsd">
  <aaa>
    <bbb>
      <ddd fff="good">
        <eee>good</eee>
        <ggg>defaultValue</ggg>
        <hhh>2</hhh>
        <jjjj xsi:nil="true"></jjjj>
      </ddd>
      <ddd fff="good">
        <eee>good</eee>
        <ggg>defaultValue</ggg>
        <hhh>2</hhh>
        <jjjj xsi:nil="true"></jjjj>
      </ddd>
      <ddd fff="good">
        <eee>good</eee>
        <ggg>defaultValue</ggg>
        <hhh>2</hhh>
        <jjjj xsi:nil="true"></jjjj>
      </ddd>
      <ddd fff="good">
        <eee>good</eee>
        <ggg>defaultValue</ggg>
        <hhh>2</hhh>
        <jjjj xsi:nil="true"></jjjj>
      </ddd>
      <ddd fff="good">
        <eee>good</eee>
        <ggg>defaultValue</ggg>
        <hhh>2</hhh>
        <jjjj xsi:nil="true"></jjjj>
      </ddd>
    </bbb>
  </aaa>
</rootTag>